{"apiVersion":"applications.sympoies.dev/v1","applicationDigest":"sha256:aaaaaaaaaaaaaaaaaaaaaaaaaaaaaaaaaaaaaaaaaaaaaaaaaaaaaaaaaaaaaaaa","applicationIdentityDigest":"sha256:b76458d0f3765a92f7afb6d98b116108f5ab10eda7fa56528366aca94b146df1","attempt":1,"inputDigest":"sha256:81f2914282b06009adceb4c7dde118842ac82ed14c69b9f333bf71c3b6cb36b1","invocationId":"notification-editor-20260913t120000z","kind":"BatchInvocationResult","output":{"message":"Service remains healthy."},"outputDigest":"sha256:ce33707e3aca9d2420526f23e7a6d3e91cf0979ea07fb660321b43f8fa666c1e","recovery":"fresh","retryable":false,"runtimeReceiptDigest":"sha256:dddddddddddddddddddddddddddddddddddddddddddddddddddddddddddddddd","terminal":"succeeded"}
